<?xml version="1.0" encoding="UTF-8"?>
<trials xmlns:xsi="http://www.w3.org/2001/XMLSchema-instance" xsi:noNamespaceSchemaLocation="who_ictrp.xsd">
  <trial>
    <main>
      <trial_id>US-2026-001</trial_id>
      <utrn>U1111-1234-5678</utrn>
      <reg_name>United States Registry</reg_name>
      <date_registration>06/01/2026</date_registration>
      <primary_sponsor>Example University</primary_sponsor>
      <public_title>Public Study Title</public_title>
      <acronym>PST</acronym>
      <scientific_title>Full Scientific Title</scientific_title>
      <scientific_acronym>FST</scientific_acronym>
      <date_enrolment>01/02/2026</date_enrolment>
      <type_enrolment>Actual</type_enrolment>
      <target_size>100</target_size>
      <recruitment_status>Recruiting</recruitment_status>
      <url>http://example.com</url>
      <study_type>interventional</study_type>
      <study_design>Randomized</study_design>
      <phase>Phase 3</phase>
      <hc_freetext>Hypertension</hc_freetext>
      <i_freetext>Drug A</i_freetext>
      <results_actual_enrolment>0</results_actual_enrolment>
      <results_date_completed>01/01/2027</results_date_completed>
      <results_url_link>http://link.com</results_url_link>
      <results_summary>Summary pending</results_summary>
      <results_date_posted>01/02/2027</results_date_posted>
      <results_date_first_publication>01/03/2027</results_date_first_publication>
      <results_baseline_char>Baseline data</results_baseline_char>
      <results_participant_flow>Normal flow</results_participant_flow>
      <results_adverse_events>None</results_adverse_events>
      <results_outcome_measures>Primary measures</results_outcome_measures>
      <results_url_protocol>http://protocol.com</results_url_protocol>
      <results_IPD_plan>Yes</results_IPD_plan>
      <results_IPD_description>Anonymous data</results_IPD_description>
    </main>

    <contacts>
      <contact>
        <type>Scientific</type>
        <firstname>John</firstname>
        <middlename>Charles</middlename>
        <lastname>Smith</lastname>
        <address>123 Flower Street</address>
        <city>New York</city>
        <country1>United States</country1>
        <zip>10001</zip>
        <telephone>+12125550199</telephone>
        <email>john@example.com</email>
        <affiliation>NY University</affiliation>
      </contact>
    </contacts>

    <countries>
      <country2>United States</country2>
    </countries>

    <criteria>
      <inclusion_criteria>Healthy adults</inclusion_criteria>
      <agemin>18</agemin>
      <agemax>65</agemax>
      <gender>Both</gender>
      <exclusion_criteria>Pregnant women</exclusion_criteria>
    </criteria>

    <health_condition_code>
      <hc_code>I10</hc_code>
    </health_condition_code>

    <health_condition_keyword>
      <hc_keyword>High blood pressure</hc_keyword>
    </health_condition_keyword>

    <intervention_code>
      <i_code>A01</i_code>
    </intervention_code>

    <intervention_keyword>
      <i_keyword>Pharmacological</i_keyword>
    </intervention_keyword>

    <primary_outcome>
      <prim_outcome>Blood Pressure Reduction</prim_outcome>
    </primary_outcome>

    <secondary_outcome>
      <sec_outcome>Quality of life</sec_outcome>
    </secondary_outcome>

    <secondary_sponsor>
      <sponsor_name>National Science Foundation</sponsor_name>
    </secondary_sponsor>

    <secondary_ids>
      <secondary_id>
        <sec_id>NCT-123456</sec_id>
        <issuing_authority>ClinicalTrials.gov</issuing_authority>
      </secondary_id>
    </secondary_ids>

    <source_support>
      <source_name>Federal Government</source_name>
    </source_support>

    <ethics_reviews>
      <ethics_review>
        <status>Approved</status>
        <approval_date>10/01/2026</approval_date>
        <contact_name>Ethics Committee</contact_name>
        <contact_address>500 Main Ave</contact_address>
        <contact_phone>+12125550188</contact_phone>
        <contact_email>ethics@hospital.com</contact_email>
      </ethics_review>
    </ethics_reviews>
  </trial>
</trials>